{
  "schemaVersion": 1,
  "id": "k.math.operations-and-number-bonds",
  "version": 1,
  "grade": "K",
  "subject": "math",
  "unitId": "k.math.unit-2",
  "title": "Putting Together and Taking Apart",
  "summary": "A five-day, hands-on sequence for representing addition and subtraction, solving stories, decomposing numbers, making ten, and building fluency within five.",
  "standardIds": ["K.OA.A.1", "K.OA.A.2", "K.OA.A.3", "K.OA.A.4", "K.OA.A.5"],
  "materials": [
    {"name": "Ten small counters in two visibly different groups", "alternatives": ["buttons and beans", "two colors of blocks", "coins and small toys"]},
    {"name": "Two paper plates or work mats", "alternatives": ["two sheets of paper", "two shallow containers"]},
    {"name": "Numeral cards from 0 through 10", "alternatives": ["numbers written on scrap paper"]},
    {"name": "A ten-frame", "alternatives": ["a hand-drawn grid with ten boxes"]},
    {"name": "Paper and a thick pencil or crayon", "alternatives": ["a small whiteboard and marker"]}
  ],
  "days": [
    {
      "day": 1,
      "title": "Show Putting Together and Taking Apart",
      "objective": "I can use objects, drawings, and words to show addition and subtraction.",
      "standardIds": ["K.OA.A.1", "K.OA.A.2"],
      "adultSetup": ["Place four counters on one mat and three on the other.", "Keep the remaining counters out of sight until the subtraction model."],
      "textRecommendation": "Choose a short picture book in which objects join a group or leave a group; pause before the result and act it out with counters.",
      "warmUp": {"minutes": 4, "directions": ["Count each group of counters separately.", "Move the groups together and count the combined group."]},
      "explicitModel": {"minutes": 7, "directions": ["Tell a joining story while moving two groups together and draw a quick picture of the action.", "Tell a taking-away story while moving counters away and cross out the counters that left.", "Name addition as putting together and subtraction as taking apart or taking away."]},
      "guidedPractice": {"minutes": 9, "directions": ["Invite the learner to act out one joining story and one taking-away story.", "Ask the learner to explain what changed before counting the result.", "Match each story to a simple drawing together."]},
      "independentPractice": {"minutes": 7, "directions": ["Complete four on-screen joining and taking-away story items.", "Use counters if needed, but let the learner decide whether the story joins or separates groups."], "templateIds": ["k.oa.a.1.represent-operations", "k.oa.a.2.word-problems"], "itemCount": 4},
      "extension": {"minutes": 4, "directions": ["Create a new story for five counters and ask an adult to act it out."]},
      "reteach": {"minutes": 6, "directions": ["Use no more than three counters.", "Say show me together or show me take away before adding numbers to the story.", "Repeat the same action with a drawing after the objects are clear."]},
      "masteryEvidence": ["Represents one addition and one subtraction situation with objects or drawings.", "Explains whether a story puts together or takes apart before finding the result."]
    },
    {
      "day": 2,
      "title": "Solve Number Stories",
      "objective": "I can solve addition and subtraction stories within ten.",
      "standardIds": ["K.OA.A.1", "K.OA.A.2"],
      "adultSetup": ["Prepare ten counters and two mats.", "Write simple story starters such as had, got more, gave away, and left."],
      "textRecommendation": "Use a familiar story or daily event with a small number of objects, such as setting out snacks or putting toys away.",
      "warmUp": {"minutes": 4, "directions": ["Act out two plus one with counters.", "Act out three minus one with the same counters."]},
      "explicitModel": {"minutes": 7, "directions": ["Read a story once without moving anything and name what is known.", "Read it again while modeling the action with counters.", "Count the result and check that the answer makes sense in the story."]},
      "guidedPractice": {"minutes": 9, "directions": ["Solve one joining story and one separating story together.", "Have the learner choose the action and the adult record a picture or equation.", "Retell each story using the final answer."]},
      "independentPractice": {"minutes": 7, "directions": ["Complete five on-screen word problems.", "After each answer, briefly say what happened to the group."], "templateIds": ["k.oa.a.1.represent-operations", "k.oa.a.2.word-problems"], "itemCount": 5},
      "extension": {"minutes": 5, "directions": ["Make two different stories that both have the answer five."]},
      "reteach": {"minutes": 6, "directions": ["Shorten the story to one sentence.", "Place the starting counters before reading the action word.", "Ask only did the group grow or get smaller before solving."]},
      "masteryEvidence": ["Solves at least one addition and one subtraction story using a self-chosen representation.", "Connects the numerical answer back to the objects in the story."]
    },
    {
      "day": 3,
      "title": "Break Numbers Into Parts",
      "objective": "I can show a number as two smaller parts in more than one way.",
      "standardIds": ["K.OA.A.1", "K.OA.A.3"],
      "adultSetup": ["Place six counters where the learner can reach them.", "Put one paper plate on each side of the work area."],
      "textRecommendation": "Choose a counting book with groups that can be rearranged, then notice that moving objects does not change how many there are.",
      "warmUp": {"minutes": 4, "directions": ["Count five counters.", "Move some counters to each plate and count the total again."]},
      "explicitModel": {"minutes": 7, "directions": ["Split five into one and four, then record 1 + 4.", "Recombine the counters and split five into two and three.", "Explain that both pairs are parts of the same whole."]},
      "guidedPractice": {"minutes": 9, "directions": ["Choose a whole from four through eight.", "Find two different ways to split it between the plates.", "Record each split with a drawing or number cards and verify by recombining."]},
      "independentPractice": {"minutes": 7, "directions": ["Complete four on-screen items about joining groups and pairs that make a whole.", "Use the plates only if a mental image is not enough."], "templateIds": ["k.oa.a.1.represent-operations", "k.oa.a.3.decompose-numbers"], "itemCount": 4},
      "extension": {"minutes": 5, "directions": ["Find every two-part split for six and arrange the recordings in order."]},
      "reteach": {"minutes": 6, "directions": ["Use a whole of three or four.", "Keep one part fixed and move one counter at a time to the other plate.", "Recount the whole after every move."]},
      "masteryEvidence": ["Decomposes a number within ten into two parts in at least two ways.", "Recombines the parts and confirms that the whole is unchanged."]
    },
    {
      "day": 4,
      "title": "Find the Part That Makes Ten",
      "objective": "I can find the number that goes with another number to make ten.",
      "standardIds": ["K.OA.A.3", "K.OA.A.4"],
      "adultSetup": ["Place a ten-frame and ten counters on the table.", "Prepare numeral cards 0 through 10."],
      "textRecommendation": "Use a counting text organized in groups of ten and notice how many spaces or objects complete each group.",
      "warmUp": {"minutes": 4, "directions": ["Fill one row of the ten-frame and count five.", "Fill the second row and count ten."]},
      "explicitModel": {"minutes": 7, "directions": ["Place six counters in the ten-frame and count the four empty spaces.", "State that six and four make ten, then verify by filling the spaces.", "Record the relationship with cards, a drawing, or 6 + 4 = 10."]},
      "guidedPractice": {"minutes": 9, "directions": ["Build three different starting numbers in the ten-frame.", "Predict the missing part, fill the spaces, and recount ten.", "Compare two combinations and notice that every completed frame has the same whole."]},
      "independentPractice": {"minutes": 7, "directions": ["Complete five on-screen number-part and make-ten items.", "Try the final two items without placing counters first."], "templateIds": ["k.oa.a.3.decompose-numbers", "k.oa.a.4.make-ten"], "itemCount": 5},
      "extension": {"minutes": 5, "directions": ["Make a set of matching cards for all pairs that make ten."]},
      "reteach": {"minutes": 6, "directions": ["Keep the ten-frame visible and use a starting number of eight or nine.", "Count empty spaces one at a time before naming the missing part.", "Repeat with one fewer starting counter."]},
      "masteryEvidence": ["Finds the missing part for at least four different make-ten combinations.", "Explains that the filled spaces and empty spaces together total ten."]
    },
    {
      "day": 5,
      "title": "Use What You Know Within Five",
      "objective": "I can solve addition and subtraction within five accurately and explain a strategy.",
      "standardIds": ["K.OA.A.1", "K.OA.A.2", "K.OA.A.3", "K.OA.A.4", "K.OA.A.5"],
      "adultSetup": ["Prepare five counters, numeral cards 0 through 5, and the two mats.", "Plan a brief movement break before the mixed independent practice."],
      "textRecommendation": "Revisit a favorite joining or taking-away story from the week and invite the learner to explain the mathematics in the pictures.",
      "warmUp": {"minutes": 5, "directions": ["Show each number from zero through five with fingers or counters.", "Say one more and one less for several starting numbers."]},
      "explicitModel": {"minutes": 6, "directions": ["Solve three plus two by recognizing parts that make five.", "Check the answer with counters, then solve five minus two by removing one known part.", "Explain that accuracy matters more than speed."]},